{
  "cohort_identities": {
    "2026-07-24-mimo-2-5-pro-project-a-diagnosis-002": {
      "difficulty": "high",
      "evaluation_protocol": "protocol_unknown",
      "operation_gate_type": "unknown",
      "source_revision": "exact-revision-reported-and-project-state-partially-verified",
      "subject_alias": "public-web-app-a",
      "task_class": "incident-diagnosis",
      "task_stage": "unknown",
      "tool_environment_class": "unknown"
    },
    "2026-07-24-mimo-2-5-pro-project-a-stage-a-001": {
      "difficulty": "high",
      "evaluation_protocol": "protocol_unknown",
      "operation_gate_type": "unknown",
      "source_revision": "exact-revision-asserted-by-executor-not-independently-proven",
      "subject_alias": "public-web-app-a",
      "task_class": "production-deployment",
      "task_stage": "unknown",
      "tool_environment_class": "unknown"
    },
    "2026-07-24-mimo-2-5-pro-project-b-config-001": {
      "difficulty": "low",
      "evaluation_protocol": "protocol_unknown",
      "operation_gate_type": "unknown",
      "source_revision": "exact-base-and-head-verified-privately",
      "subject_alias": "public-python-service-b",
      "task_class": "routine-repository-change",
      "task_stage": "unknown",
      "tool_environment_class": "unknown"
    },
    "2026-07-24-mimo-2-5-pro-public-web-app-a-provenance-repair-003": {
      "difficulty": "high",
      "evaluation_protocol": "protocol_unknown",
      "operation_gate_type": "unknown",
      "source_revision": "exact-private-base-and-head-controller-verified",
      "subject_alias": "public-web-app-a",
      "task_class": "security-remediation",
      "task_stage": "unknown",
      "tool_environment_class": "unknown"
    },
    "2026-07-25-claude-opus-5-business-automation-a-amendment-004": {
      "difficulty": "high",
      "evaluation_protocol": "protocol_unknown",
      "operation_gate_type": "unknown",
      "source_revision": "exact-private-revision-controller-verified",
      "subject_alias": "business-automation-a",
      "task_class": "complex-repository-change",
      "task_stage": "unknown",
      "tool_environment_class": "unknown"
    },
    "2026-07-25-claude-opus-5-business-automation-a-amendment-005": {
      "difficulty": "high",
      "evaluation_protocol": "protocol_unknown",
      "operation_gate_type": "unknown",
      "source_revision": "exact-private-revision-controller-verified",
      "subject_alias": "business-automation-a",
      "task_class": "complex-repository-change",
      "task_stage": "unknown",
      "tool_environment_class": "unknown"
    },
    "2026-07-25-claude-opus-5-business-automation-a-amendment-006": {
      "difficulty": "high",
      "evaluation_protocol": "protocol_unknown",
      "operation_gate_type": "unknown",
      "source_revision": "exact-private-revision-controller-verified",
      "subject_alias": "business-automation-a",
      "task_class": "complex-repository-change",
      "task_stage": "unknown",
      "tool_environment_class": "unknown"
    },
    "2026-07-25-deepseek-v4-pro-evaluation-ledger-scheduled-review-architecture-001": {
      "difficulty": "high",
      "evaluation_protocol": "protocol_unknown",
      "operation_gate_type": "unknown",
      "source_revision": "exact-public-main-and-authoritative-issue-controller-verified",
      "subject_alias": "evaluation-ledger-scheduled-review-a",
      "task_class": "architecture-proposal",
      "task_stage": "unknown",
      "tool_environment_class": "unknown"
    },
    "2026-07-25-mimo-2-5-pro-governance-design-gate-001": {
      "difficulty": "high",
      "evaluation_protocol": "protocol_unknown",
      "operation_gate_type": "unknown",
      "source_revision": "exact-public-base-and-head-controller-verified",
      "subject_alias": "governance-design-gate-a",
      "task_class": "architecture-proposal",
      "task_stage": "unknown",
      "tool_environment_class": "unknown"
    },
    "2026-07-25-mimo-2-5-pro-governance-tooling-a-amendment-002": {
      "difficulty": "high",
      "evaluation_protocol": "protocol_unknown",
      "operation_gate_type": "unknown",
      "source_revision": "exact-public-base-previous-head-and-amendment-head-controller-verified",
      "subject_alias": "governance-tooling-a",
      "task_class": "complex-repository-change",
      "task_stage": "unknown",
      "tool_environment_class": "unknown"
    },
    "2026-07-25-mimo-2-5-pro-governance-tooling-a-amendment-003": {
      "difficulty": "high",
      "evaluation_protocol": "protocol_unknown",
      "operation_gate_type": "unknown",
      "source_revision": "exact-public-base-previous-head-and-gate3-head-controller-verified",
      "subject_alias": "governance-tooling-a",
      "task_class": "complex-repository-change",
      "task_stage": "unknown",
      "tool_environment_class": "unknown"
    },
    "2026-07-25-mimo-2-5-pro-governance-tooling-a-implementation-001": {
      "difficulty": "medium",
      "evaluation_protocol": "protocol_unknown",
      "operation_gate_type": "unknown",
      "source_revision": "exact-public-base-and-head-controller-verified",
      "subject_alias": "governance-tooling-a",
      "task_class": "complex-repository-change",
      "task_stage": "unknown",
      "tool_environment_class": "unknown"
    },
    "2026-07-25-mimo-2-5-pro-private-quote-service-a-configuration-admission-005": {
      "difficulty": "high",
      "evaluation_protocol": "protocol_unknown",
      "operation_gate_type": "unknown",
      "source_revision": "exact-private-current-revision-controller-verified; provider evidence executor-reported and partially cross-checked",
      "subject_alias": "private-quote-service-a",
      "task_class": "provider-operation",
      "task_stage": "unknown",
      "tool_environment_class": "unknown"
    },
    "2026-07-25-mimo-2-5-pro-private-quote-service-a-configuration-admission-amendment-006": {
      "difficulty": "high",
      "evaluation_protocol": "protocol_unknown",
      "operation_gate_type": "unknown",
      "source_revision": "exact-private-current-revision-controller-verified; provider evidence executor-reported and selectively cross-checked against versioned upstream source",
      "subject_alias": "private-quote-service-a",
      "task_class": "provider-operation",
      "task_stage": "unknown",
      "tool_environment_class": "unknown"
    },
    "2026-07-25-mimo-2-5-pro-private-quote-service-a-env-migration-002": {
      "difficulty": "high",
      "evaluation_protocol": "protocol_unknown",
      "operation_gate_type": "unknown",
      "source_revision": "exact-private-revision-controller-verified; provider state executor-and-owner-reported",
      "subject_alias": "private-quote-service-a",
      "task_class": "provider-operation",
      "task_stage": "unknown",
      "tool_environment_class": "unknown"
    },
    "2026-07-25-mimo-2-5-pro-private-quote-service-a-evidence-recovery-004": {
      "difficulty": "high",
      "evaluation_protocol": "protocol_unknown",
      "operation_gate_type": "unknown",
      "source_revision": "exact-private-current-revision-controller-verified; provider evidence executor-reported and tracker-controller-reconciled",
      "subject_alias": "private-quote-service-a",
      "task_class": "incident-diagnosis",
      "task_stage": "unknown",
      "tool_environment_class": "unknown"
    },
    "2026-07-25-mimo-2-5-pro-private-quote-service-a-hosting-diagnosis-003": {
      "difficulty": "high",
      "evaluation_protocol": "protocol_unknown",
      "operation_gate_type": "unknown",
      "source_revision": "exact-private-current-revision-controller-verified; provider state executor-reported",
      "subject_alias": "private-quote-service-a",
      "task_class": "incident-diagnosis",
      "task_stage": "unknown",
      "tool_environment_class": "unknown"
    },
    "2026-07-25-mimo-2-5-pro-private-quote-service-a-provider-preflight-001": {
      "difficulty": "high",
      "evaluation_protocol": "protocol_unknown",
      "operation_gate_type": "unknown",
      "source_revision": "exact-private-revision-reported-and-tracker-controller-inspected",
      "subject_alias": "private-quote-service-a",
      "task_class": "provider-operation",
      "task_stage": "unknown",
      "tool_environment_class": "unknown"
    },
    "2026-07-25-mimo-2-5-pro-public-web-app-a-provenance-amendment-004": {
      "difficulty": "high",
      "evaluation_protocol": "protocol_unknown",
      "operation_gate_type": "unknown",
      "source_revision": "exact-private-base-and-head-controller-verified",
      "subject_alias": "public-web-app-a",
      "task_class": "security-remediation",
      "task_stage": "unknown",
      "tool_environment_class": "unknown"
    },
    "2026-07-25-mimo-2-5-pro-public-web-app-a-provenance-amendment-005": {
      "difficulty": "high",
      "evaluation_protocol": "protocol_unknown",
      "operation_gate_type": "unknown",
      "source_revision": "exact-private-base-and-head-controller-verified",
      "subject_alias": "public-web-app-a",
      "task_class": "security-remediation",
      "task_stage": "unknown",
      "tool_environment_class": "unknown"
    },
    "2026-07-25-mimo-2-5-pro-public-web-app-a-provenance-amendment-006": {
      "difficulty": "high",
      "evaluation_protocol": "protocol_unknown",
      "operation_gate_type": "unknown",
      "source_revision": "exact-private-base-and-head-controller-verified",
      "subject_alias": "public-web-app-a",
      "task_class": "security-remediation",
      "task_stage": "unknown",
      "tool_environment_class": "unknown"
    },
    "2026-07-25-mimo-2-5-pro-public-web-app-a-provenance-amendment-007": {
      "difficulty": "high",
      "evaluation_protocol": "protocol_unknown",
      "operation_gate_type": "unknown",
      "source_revision": "exact-private-base-head-and-squash-tree-controller-verified",
      "subject_alias": "public-web-app-a",